{
    "version": "1.3",
    "osArch": "x86_64",
    "images": [
        {
            "image": {
                "path": "images/esp.rawzst",
                "compressedSize": 839345,
                "uncompressedSize": 8388608,
                "sha384": "2decc64a828dbbb76779731cd4afd3b86cc4ad0af06f4afe594e72e62e33e520a6649719fe43f09f11d518e485eae0db"
            },
            "mountPoint": "/boot/efi",
            "fsType": "vfat",
            "fsUuid": "A1B2-C3D4",
            "partType": "c12a7328-f81f-11d2-ba4b-00a0c93ec93b",
            "verity": null
        },
        {
            "image": {
                "path": "images/root.rawzst",
                "compressedSize": 192874245,
                "uncompressedSize": 899494400,
                "sha384": "98ea4adbbb8ce0220d109d53d65825bd5a565248e4af3a9346d088918e7856ac2c42e13461cac67dbf3711ff69695ec3"
            },
            "mountPoint": "/",
            "fsType": "ext4",
            "fsUuid": "88d2fa9b-7a32-450a-a9f8-aa9c3de79298",
            "partType": "4f68bce3-e8cd-4db1-96e7-fbcaf984b709",
            "verity": {
                "image": {
                    "path": "images/root-verity.rawzst",
                    "compressedSize": 26214400,
                    "uncompressedSize": 524288000,
                    "sha384": "51356c53fbdd5c196395ccd389116f2e7769443cb4e945bc9b6bc3c805cf857c375df010469f8f45ef0c5b07456b023d"
                },
                "roothash": "646c82fa4c3f97e6cddc3996315c7f04b2beb721fb24fa38835136492a84eb19",
                "signature": {
                    "path": "images/root-verity-sig.rawzst",
                    "compressedSize": 512,
                    "uncompressedSize": 1024,
                    "sha384": "9ad73493dd99156f81ace36e0974ca30ad636215e044b3db6a549aaee5ea602d093d83b787bf41ddac21fd4e95e30425"
                }
            }
        }
    ],
    "osRelease": "NAME=\"Microsoft Azure Linux\"\nVERSION=\"3.0.20240824\"\nID=azurelinux\nVERSION_ID=\"3.0\"\nPRETTY_NAME=\"Microsoft Azure Linux 3.0\"\nANSI_COLOR=\"1;34\"\nHOME_URL=\"https://aka.ms/azurelinux\"\nBUG_REPORT_URL=\"https://aka.ms/azurelinux\"\nSUPPORT_URL=\"https://aka.ms/azurelinux\"\n",
    "bootloader": {
        "type": "systemd-boot",
        "systemdBoot": {
            "entries": [
                {
                    "type": "uki-standalone",
                    "path": "/boot/efi/EFI/Linux/azurelinux-uki.efi",
                    "cmdline": "root=/dev/disk/by-partuuid/88d2fa9b-7a32-450a-a9f8-aa9c3de79298 ro",
                    "kernel": "6.6.78.1-3.azl3"
                }
            ]
        }
    },
    "osPackages": [
        {
            "name": "systemd",
            "version": "255",
            "release": "20.azl3",
            "arch": "x86_64"
        }
    ],
    "disk": {
        "size": 2147483648,
        "type": "gpt",
        "lbaSize": 512,
        "gptRegions": [
            {
                "image": {
                    "path": "images/primary-gpt.rawzst",
                    "compressedSize": 16384,
                    "uncompressedSize": 32768,
                    "sha384": "a3f5c6e2b4d5e6f7a8b9c0d1e2f3a4b5c6d7e8f9a0b1c2d3e4f5a6b7c8d9e0f1a2b3c4d5e6f7a8b9c0d1e2f3a4b5c6d7"
                },
                "type": "primary-gpt"
            },
            {
                "image": {
                    "path": "images/esp.rawzst",
                    "compressedSize": 839345,
                    "uncompressedSize": 8388608,
                    "sha384": "2decc64a828dbbb76779731cd4afd3b86cc4ad0af06f4afe594e72e62e33e520a6649719fe43f09f11d518e485eae0db"
                },
                "type": "partition",
                "number": 1
            },
            {
                "image": {
                    "path": "images/root.rawzst",
                    "compressedSize": 192874245,
                    "uncompressedSize": 899494400,
                    "sha384": "98ea4adbbb8ce0220d109d53d65825bd5a565248e4af3a9346d088918e7856ac2c42e13461cac67dbf3711ff69695ec3"
                },
                "type": "partition",
                "number": 2
            },
            {
                "image": {
                    "path": "images/root-verity.rawzst",
                    "compressedSize": 26214400,
                    "uncompressedSize": 524288000,
                    "sha384": "51356c53fbdd5c196395ccd389116f2e7769443cb4e945bc9b6bc3c805cf857c375df010469f8f45ef0c5b07456b023d"
                },
                "type": "partition",
                "number": 3
            },
            {
                "image": {
                    "path": "images/root-verity-sig.rawzst",
                    "compressedSize": 512,
                    "uncompressedSize": 1024,
                    "sha384": "9ad73493dd99156f81ace36e0974ca30ad636215e044b3db6a549aaee5ea602d093d83b787bf41ddac21fd4e95e30425"
                },
                "type": "partition",
                "number": 4
            }
        ]
    },
    "compression": {
        "maxWindowLog": 22
    }
}
